{
  "schema_version": "1.0.0",
  "order_no": "SP20261020K7M2QX",
  "plan_code": "starter_monthly",
  "plan_display_name": "初芽月度陪伴",
  "billing_period": "monthly",
  "period_months": 1,
  "unit_price_cny_cents": 3900,
  "discount_cny_cents": 0,
  "payable_cny_cents": 3900,
  "paid_cny_cents": 3900,
  "refunded_cny_cents": 0,
  "status": "paid",
  "expires_at": "2026-10-20T09:30:00Z",
  "paid_at": "2026-10-20T09:04:12Z",
  "created_at": "2026-10-20T09:00:00Z"
}
